{"objective":"Reconcile both conflicted hooks so authoritative worktree-rooted evidence resolution and fail-closed/degrade-loudly I/O resilience operate together, with interaction-focused regression coverage.","requirements":["Resolve `.ai/hooks/stop_guard.py` by retaining `repo_root()` and `task_directory()` while retaining `Unreadable` and `read_guarded()`, and route every verdict-dependent artifact read through `read_guarded()`.","Ensure `stop_guard.py` returns `BLOCK` (exit 2), never exit 1, when an implementation note or blackboard located through the exported `ORCHESTRATOR_TASK_DIR` cannot be decoded or read.","Resolve `.ai/hooks/session_start.py` using `task_directory()` and `constitution_path()` for authoritative locations, `read_or_warn()` for both blackboard and constitution reads, `CONSTITUTION_RELATIVE` for the constitution label, and `emit()` for output.","Keep the `constitution.is_file()` pre-check so an absent constitution remains silent while an existing unreadable constitution warns on stderr.","Remove all merge conflict markers and ensure both hooks byte-compile.","Repair `HookCase.run_hook` so tests explicitly control `ORCHESTRATOR_TASK_DIR`, `ORCHESTRATOR_REPO_ROOT`, and `ORCHESTRATOR_CONSTITUTION` instead of inheriting ambient orchestrator values.","Add interaction tests proving an undecodable artifact found through an exported task directory causes stop_guard to fail closed and a non-cp1252 blackboard found through an exported task directory is injected as UTF-8.","Keep all existing hook resilience behavior and pass the complete validation profile and CI-supported suite."],"files_to_modify":[{"path":".ai/hooks/stop_guard.py","purpose":"Reconcile authoritative task-directory resolution with guarded artifact reads and fail-closed exit behavior."},{"path":".ai/hooks/session_start.py","purpose":"Reconcile authoritative blackboard and constitution resolution with loud read degradation and explicit UTF-8 emission."},{"path":"test_hook_resilience.py","purpose":"Neutralize inherited rooting variables and add interaction-focused tests for exported evidence paths, malformed input, non-cp1252 output, and constitution handling."}],"files_to_create":[],"acceptance_criteria":[{"id":"AC-1","statement":"Stop guard locates an undecodable required artifact through an exported ORCHESTRATOR_TASK_DIR rather than cwd and fails closed with exit 2 and a diagnostic, never exit 1.","verify":"{python} -m unittest test_hook_resilience.HookRootingResilienceInteractionTests.test_stop_guard_fails_closed_on_undecodable_exported_task_artifact","depends_on":[".ai/hooks/stop_guard.py","test_hook_resilience.py"],"material":true},{"id":"AC-2","statement":"Session start locates a blackboard through an exported task directory and emits its non-cp1252 content intact as UTF-8.","verify":"{python} -m unittest test_hook_resilience.HookRootingResilienceInteractionTests.test_session_start_injects_non_cp1252_exported_blackboard","depends_on":[".ai/hooks/session_start.py","test_hook_resilience.py"],"material":true},{"id":"AC-3","statement":"Session start silently skips an absent constitution but warns for an existing undecodable constitution resolved through the exported constitution path.","verify":"{python} -m unittest test_hook_resilience.ExportedConstitutionResilienceTests.test_absent_constitution_is_silent test_hook_resilience.ExportedConstitutionResilienceTests.test_undecodable_constitution_warns","depends_on":[".ai/hooks/session_start.py","test_hook_resilience.py"],"material":true},{"id":"AC-4","statement":"The hook test harness overrides all authoritative rooting variables so ambient orchestrator values cannot redirect fixtures, and the complete hook-resilience module passes.","verify":"{python} -m unittest -v test_hook_resilience","depends_on":[".ai/hooks/stop_guard.py",".ai/hooks/session_start.py","test_hook_resilience.py"],"material":true},{"id":"AC-5","statement":"Both reconciled hook files contain no conflict syntax and byte-compile successfully.","verify":"{python} -B -m py_compile .ai/hooks/stop_guard.py .ai/hooks/session_start.py","depends_on":[".ai/hooks/stop_guard.py",".ai/hooks/session_start.py"],"material":true},{"id":"AC-6","statement":"The full discovered unittest suite is non-empty and passes under the validation interpreter.","verify":"{python} -c \"import sys,unittest; s=unittest.defaultTestLoader.discover('.'); n=s.countTestCases(); print('discovered',n); r=unittest.TextTestRunner(verbosity=1).run(s); sys.exit(0 if n>0 and r.wasSuccessful() else 1)\"","depends_on":[],"material":false},{"id":"AC-7","statement":"The validation profile's workflow-script compile check passes unchanged.","verify":"{python} -B -m py_compile .ai/scripts/orchestrator.py .ai/scripts/review-package.py","depends_on":[],"material":false},{"id":"AC-8","statement":"The task-state schema remains valid JSON.","verify":"{python} -m json.tool .ai/schemas/task-state.schema.json","depends_on":[],"material":false},{"id":"AC-9","statement":"The plan schema remains valid JSON.","verify":"{python} -m json.tool .ai/schemas/plan.schema.json","depends_on":[],"material":false}],"constraints":["Modify exactly `.ai/hooks/stop_guard.py`, `.ai/hooks/session_start.py`, and `test_hook_resilience.py`; create no files and do not touch `_support.py`.","TASK-007 and TASK-008 requirements, plans, and evidence remain byte-identical and are not evidence for TASK-009.","Preserve main's `constitution.is_file()` control flow before calling `read_or_warn(constitution)`.","Do not address the previously recorded `PYTHONIOENCODING` test-harness finding or any unrelated follow-up.","Use only the Python standard library and existing repository patterns.","Code must remain portable across `ubuntu-latest` with Python 3.9 and 3.12; multi-version execution belongs to the CI matrix.","The reconciliation is intended to land as one merge commit on `feature/hook-resilience`; no intermediate commit with unparsable hooks may enter history, and the worker must not create commits unless explicitly authorized.","Do not weaken or remove existing tests."],"risks":["A partially reconciled conflict can leave calls to undefined helpers even after conflict markers are removed.","Testing resilience only against cwd fixtures would allow authoritative exported-path resolution to regress unnoticed.","Inherited ORCHESTRATOR path variables can redirect all existing HookCase fixtures to the live task tree and produce misleading results.","Reading the constitution directly instead of through `read_or_warn()` would silently discard the TASK-007 degradation behavior while still parsing.","Writing through `sys.stdout` instead of `emit()` can pass on UTF-8 locales while failing under a cp1252 locale.","A missing-file test could accidentally trigger warning behavior if the exported constitution fixture is not isolated precisely."],"open_questions":[],"test_strategy":["Update `HookCase.run_hook` to set explicit isolated values for all three authoritative path variables before applying per-test overrides.","Add a stop-guard subprocess test with cwd separated from an exported task directory, valid companion evidence, and malformed UTF-8 in a required exported artifact; assert exit 2 and the exported path diagnostic.","Add a session-start subprocess test with cwd separated from an exported task directory and non-cp1252 blackboard content; decode stdout as UTF-8 and assert the exact content is present.","Add exported-constitution tests distinguishing an absent file, which stays silent, from an existing malformed UTF-8 file, which exits successfully while warning on stderr.","Run the complete named `test_hook_resilience` module to retain TASK-007 regression coverage and the new interaction cases.","Byte-compile both hooks independently of `.ai/validation.json`, then run a non-empty full unittest discovery and each remaining validation-profile check."]}